context_id,context_note
3263,"Gravel internal floor / levelling layer in the north east corner of Room 4 of timber House 1. Believed to be the same levelling deposit as (3260) to the south and (6474) to the west in Room 4. Strat below (5799). Strat above (6520). Butts (4645), (4635). Cut by [1090], [3263], [1095]. Part of Group 6469. Completely removed in 2005. Plan no: 16.95, 16.98 Sample no: 1271, 1272 Accuracy rating - 4"
3264,Dark grey friable silt measuring 25cm deep containing 15-35% rounded stones 6mm - 6cm.
3264,Fill of post-hole 3265
3264,Plan no: 16.97
3265,Cut for post-hole containing (3264)
3265,Post hole in NE room of diagonal room.  Unclear use. Plan no: 16.99
3265,rounded cut measuring 13cm long x 13cm wide x 0.25cm deep with sharp slope at the top and bottom and verticle sides with a slightly rounded base.
3266,Levelling deposit of yellow clay.  Clay overlaying flint and tile wall.  Deposit excavated to wall - see plan. Plan no: 10.34
3266,"Mixed clay  spread in room 3, House 1."
3266,"Yellow friable clay measuring 1cm - 14cm, 130cm x 280cm x 170cm x 300cm, containing cbm."
3267,"dark brown loose silt with orange friable clay, both sandy measuring 1-3cm and containing 5-15% sub-angular stones, measuring 2-6cm."
3267,"Gravel mid way in north side of Room 1, House 1."
3267,"Silty occupation deposit, overlying truncated layer of thin clay. Plan no: 16.101"
3268,"Black brown friable silt measuring 3cm deep x 107cm long x 37cm wide, containing >50% charcoal and <1% sub-angular stones measuring 6-20mm."
3268,"Charcoal fill of robber trench. Plan no: 15.76, 16.102"
3268,"Charcoal spread in robber trench, room 1, House 1 containing [3283]"
3269,"Accumulation, especially in slumps, in Rm 2, House 1. Deposit truncated and lost during excavation."
3269,"Friable dark grey silt accumulation with <1% 2-6mm charcoal flecks. This was a variable silty accumulation which was not widespread across the room, <1cm in depth."
3269,"Silt and gravel in room 2, House 1 below (1912)"
3270,"Beam slot fill Room 1, House 1"
3270,"Dark brown friable clayey sand, measuring 135cm x 20cm containing <5% sub-angular stones, 2-6cm."
3270,"Small find SF2348 - gaming counter. Fill of probable beam slot, room 1, House 1. Plan no: 16.105"
3271,Extension to wall (1533) in SW direction.  Constructed over C-P floor (3254) For plan see (1533)
3271,Flint and CBM with medium to large materials (c 10-20cm long) with no finish.  Material on top of clay 'plug' of bonding material.  Dimensions are NW/SE 'internal' with house 1.
3271,SW section of wall 1533
3272,Beam slot cut containing (5760)
3272,"Originally thought to be a robber trench running NW-SE, but decided in 2003 that this feature is more likely to be a beam slot, probably associated with the timber phase building. Intruded into at NW end by possible beam slot. SE edge is arbitrary and may continue to join robber trench running E-W. SE edge extended through to probable line of E-W trench. <BR>Plan no: 16.104  {}"
3272,"Wavily linear in plan, measuring 2.69m long with variable width (0.25m at narrowest). Depth varies from 0.02m to 0.08m<BR>Break of slope (top &amp; base): 45 degrees or less <BR>Sloping sides with an undulating base<BR>Contains (5760)  {}"
3273,Ceramic tile spread adjacent to wall (3201). Floor.
3273,"Loose red ceramic tiles, no bonding material remaining. Clear truncated inner edge"
3273,"Probable remaining lense of floor make-up, truncated by later activity in Room1, House 1. Clearly associated with the room boundary wall 3201. Plan no: 21.31"
3274,Foundation fill below second course
3275,Building debris fill below (3268)
3275,"Friable browny black silty clay containing inclusions of mortar, CBM and wall plaster. The deposit is c.5cms deep, 29 cms wide and 97 cms long."
3275,The fill of a robber trench consisting of building rubble.
3276,Crushed CBM floor below (3259)
3276,"Crushed red brick surface and hard, dense compacted gravel Inclusions: CBM 70%, Gravel 1-5% (A) (2-6mm) (6-20mm) c.1-2cms in depth with a range of 0-6cm Edge definition clear but variably truncated and wo rn"
3276,The possible remains of a crushed brick floor. No sign of any bonding material - the floor is very fragile. Variation of thickness. Completely removed in 2003. Plan no: 16.109
3277,Fill of a beam slot. Plan no: 16.103
3277,"Fill of beam slot in Room 1, House 1."
3277,Friable yellow clayey sand with 15-35% inclusions of CBM. The deposit is c.5cms in depth.
3278,Clay plug below (3275) in robber trench
3278,"Sticky and cohesive yellow clay with silt and CBM inclusions. The deposit was 75cms long, 33cms wide and 6cms in depth."
3278,The fill of a robber trench.
3279,Beam slot cut containing (3277)
3279,"Cut for beam slot containing (3277). In 2003, this beam slot was associated with beam slots [1967], [3280], [4555], [4087], [4096] and [4001] which denote a timber structure spanning and predating the NE wall of House 1.  Plan no: 16.111"
3279,Rectangular in plan with angular corners and dimensions of 0.78m by 0.26m by 0.11m in depth. The sides were vertical and the base was flat but uneven. Contains (3277)
3280,Beam slot cut containing (3270)
3280,"Beam slot cut containing (3270). In 2003, this beam slot was associated with beam slots [1967], [3279], [4555], [4087], [4096] and [4001] which denote a timber structure spanning and predating the NE wall of House 1.  Plan no: 16.110"
3280,Linear in plan with ill-defined corners and measuring 1.22m x 0.3 with a depth of 0.14m Break of slope (top): sharp;  (base): fairly uneven/concave  Flat uneven base Contains (3270)
3281,10 yr 3/1 very dark grey friable silt measuring 46 x 67cm with a variable depth of 1-9cm.  Contains 1-15% of angular and sub-angular stones.
3281,"NE part of North Aisle, House 1"
3281,Possible occupation layer in north aisle of House 1
3282,Clay in north aisle House 1
3282,Same as (3048). Strat above: (4565).
3283,"Cut for robber trench containing (3268), (3275), and (3278)"
3283,"Cut for robber trench southern side of room 1, house 1"
3283,"Cut with unclear corners measuring 80cm long x 30cm wide x 10-12cm deep with a sharp slope at top and base, with gradually sloping sides and an irregular base."
3284,"Tile interspersed with one or two large flints and some chalk blocks.  Tile = largest 13.5cm x 16.5cm, Flint = 13cm x 7cm.  Clay/gravel matrix beneath tiles, faces are North East with a clay and gravel bonding."
3284,Wall (3284) lies adjacent to and parallel with wall(2022).  2022 is later than 3284 but it has not been excavated and may or may not be the next event.  Clay layer overlay both 2022 and 3284.
3284,Wall adjacent (2022)
3285,Wall adjacent (2022)
3286,"10 yr  3/2 Very dark greyish brown firm silty clay measuring 4cm thick x 2-3m containing CBM, pottery and bone and 15-35% sub-rounded stones measuring 6-20mm."
3286,"Plan no: 1580, 1579"
3286,Possible occupation layer in south aisle of House 1
3287,Clay in south aisle
3287,Levelling deposit of clay in the south aisle of House 1 Plan no: 15.81
3287,"Yellow, compacted clay Inclusions: CBM, charcoal, animal tooth, pottery sherds, glass, chalk Gravel/stones: 15-35% (S-A) (2-6cm)"
3288,"2.5 4/5 Olive brown, compacted but friable sandy clay.  Inclusions: 5-10% at the north end and 80% at the south end  Stones: Unsorted, rounded & sub angular flint gravel (10mm-50mm) with small fragments of CBM (<1%) Extent: 380cm x 670cm Depth: 3cm"
3288,Clay layer
3288,"Clay levelling layer in Room 2, House 1. Variable depth due to attempts to level off two deep slumps in the floor. Plan no: 15.92, 15.93 - The 2001 plans were amended in 2002, however this amendment is under question and has not yet been digitised."
3289,A wall foundation mainly made up of CBM. Lower than 1141 but probably part of the same building phase. This part of the wall appears to be a separate entity from 1797. Not excavated in 2001.
3289,"Loose friable yellow brown clay, c.2.3m long and 0.75m wide."
3289,Wall foundation
3290,10yr 6/8 brownish yellow friable sandy clay measuring 1cm x 30cm x 20cm containing charcoal and small stones.
3290,Possible cap of post-hole pre-ex.
3290,Possible post hole cap
3291,10 yr 6/8 brownish yellow firm silty clay measuring 65cm x 2m x 2cm thick containing 5-15% sub-rounded stones measuring 2-6cm.  Section number 349.
3291,A clay layer overlaying a gravel floor.  The gravel floor is made up of coarser gravel than that mapped to the east.
3291,Possible occupation layer below (3286)
3292,Clay below (3281)
3293,Cleaning layer
3293,"Very mixed, friable sandy silt measuring 1cm-3cm, containing CBM, bone and flint"
3294,"Fill of robber trench [3708]. This feature was partly excavated in 2001 and it was shown to be far more extensive in 2002. The fill was very mixed and, at the time looked layered - however it was not. There was also a high concentration of CBM and some mortar was also recovered.  N.B. (3294)=(3696) (3921) (3922)             Plan no: 10.67, 10.68, 11.48, 11.99  Sample no: 641 (mortar sample)"
3294,Friable mixed silty clay  Inclusions: 15-35% stones of all shapes and ranging in size from 2mm to 20cm;  1-5% flint;  5% CBM;  Bone and pottery particularly present in the lower levels. 10-15cm thick
3294,Tile and clay foundation
3295,Firm black silty clay with 1-5% inclusions of large pieces of charcoal and fragmented CBM. It was c.2cm thick with an extent of 0.3m by 0.2m.
3295,What was previously thought to be a fill was actually a thick layer of compacted silt and clay. The heavy inclusions of charcoal contributed to its dark colour.
3296,"10 yr 3/2 Very dark greyish brown; 10yr 5/4 yellowish brown stoney/gravel with CBM measuring 2-3m x 6cm thick, containing 35-70% of sub-angular to rounded stones measuring 2-20cm."
3296,"Metalled gravel surface below clay. 2003: No remains of metalled surface visible on cleaning, but there was a remnant of a compact mortar base at the northern part of the baulk suggesting a make-up layer for (3296). No record or removal , but no extant evidence either. Plan no: 15.84, 15.85  Section no: 349?"
3296,"Metalled surface in NE part of southern section, south aisle, House 1."
3297,"A mixture of flint, chalk, limestone and CBM making up a wall which was cut into context 3700. Plan no: 10.44 and 10.42. (2299) is part of this wall"
3297,"A wall of flint, chalk, limestone and CBM. The flint was roughly shaped, the tile was broken and the limestone was squared and possibly reused. The wall had a silty clay bonding. The wall was c.4m in length and 0.15m wide."
3297,Wall
3298,Dark greyish brown friable sandy clay 3cm-5cm in depth. Inclusions: CBM Stones: 35-70% (S-A) (2-6cm)
3298,Metalled surface
3298,Metalled surface within the south aisle of House 1 Plan no: 15.86
3299,"A gravel layer sandwiched between two clay layers, probabaly forming a surface. The edge was truncated half way across the room, making the context confined to the southern half. Completely removed in 2002 Plan no: 15.87, 15.88, 16.118"
3299,Friable grey sandy silt with inclusions of CBM. The deposit varied in depth: 10-70mm and had a length of 2.3m and a width of 3.95m.
3299,Gravel layer
3301,"Dark greyish brown, friable clay loam containing 15% angular to sub angular gravel pebbles of 6-20mm. 50cm x 80cm x 40cm deep."
3301,Fill of pit [1326]
3301,Partially excavated in 1998. Is cut by Victorian trench 1257. Excavation continued in 2001.
3302,"Charcoal staining to the north west of the cut. Also charcoal staining (3310) dipping into the cut [3302], underlying main fill (1640)"
3302,Cut of hearth containing 1640 and 3310
3302,Roughly circular cut measuring 109cm x 127cm x 15cm. Has gently sloping sides and an uneven base. Clear edge definition
3303,"Dark greyish brown, friable, clay silt. 3cm x 130cm x 57cm Contains CBM flecks and charcoal flecks. Reasonable edge definition"
3303,Dark spread containing CBM
3303,North west of Victorian trench 1257 Overlies 3222 and [3332]
3304,"Dark greyish brown, friable clayey loam containing 5% angular to sub angular flint pebbles and some charcoal and CBM. 55cm x 52cm x 8-13cm deep"
3304,Fill of shallow circular feature [3306]
3304,Thought to be a post-hole at first but not. Animal burrowing or other disturbance in north eastern half. Section 302
3305,Adjacent to and north west of post-hole [3332] and Victorian trench 1257 Possibly related to post-hole [3332]
3305,"Dark greyish brown, friable clay silt containing flecks of CBM. 10cm x 18cm x 100cm. Good edge definition"
3305,Fill of beam slot [3331]
3306,Circular feature measuring 55cm x 52cm x 8-13cm deep. Gradual breaks of slope with shallow and irregular sides and flattish base.
3306,Cut for shallow circular feature containing (3304)
3306,Cuts into the yellow clay on the north-west of the north wall of House 1. Originally thought to be possible post-hole but this not the case.  There is some distrurbance in the north eastern half which may be animal  burrowing.Section 302
3307,"Dark brownish grey, friable sandy silt. Contains 35-70% gravel pebbles, angular to rounded and 2mm - 6cm 210cm x 140cm. Diffuse edge definition Trowelled in dry conditions"
3307,Localised gravel spread.
3307,"Situated in immediate proximity of northern wall, House 1. Overlying yellow clay."
3308,"Dark greyish brown, friable loamy clay containing 15-35% sub angular to sub rounded gravel pebbles of 6mm-6cm. 88cm x 62cm x 26cm. Clear edge definition"
3308,Fill of post-hole or pit [3321]
3308,Situated in very north west corner of  House 1. Overlying deliberate pot deposit 3320 / SF 2039 and surrounding it. Sampled 100% Contained bone and other pottery sherds unrelated to SF2039
3309,Burning deposit
3309,"Dark reddish brown, friable burnt clay. Contains 15% charcoal. Measures 5cm x 60cm x 30cm. Clear edge definition"
3309,"Set into the yellow clay within House 1, situated just north east of wall 2004. Does not have a cut as such, just simply stained the clay surface. Probably as the result of a single short burning episode. Localised."
3310,"Black grey charcoal, friable charcoal.  Contains 35-70% angular to sub rounded stones of 6mm-6cm. 127cm x 96cm. Vague edge definition"
3310,Charcoal stain is very significant stratigraphically as it reveals that gravel spread (1254) overlies the hearth pit and another gravel surface that 3310 staining has formed on. Hence hearth pit was in use between the two gravel depositions.
3310,Charcoal stain of hearth pit [3302]
3311,"Overlies demolition layer (3312). In the immediate vicinity of north wall of House 1. One of the upper yellow clay spreads north west of House 1, maybe to level the ground or cover up the demolition layer."
3311,Yellow brown tenacious clay containing 10% sub angular gravel of 2-6cm. 4cm x 100cm x 150cm Trowelled in dry conditions Clear edge definition
3311,Yellow clay spread
3312,"Dark brown friable silty clay. Contains 5% flint nodules, 35% sub rounded stones of 2-6cm,  and 10% CBM flecks. 2cm x 200cm x 150cm."
3312,Demolition spread
3312,Underlies clay spread 3311. In the immediate proximity of north wall of House 1 (1154) and lies to south of wall 1664
3313,Probable levelling deposit
3313,"Probably dumped in this area as a levelling deposit for the construction of the buildings in particular, House 1. Probably the same as other yellow clays within House 1 and (3374) or (3375) to the south of House 1. (3313) is the same as (3049), (3048) and (4111) further to the NE. <BR>Plan no: 2.21, 3.36, 3.37, 3.39, 3.45, 3.49, 3.97,&nbsp;4.10, 4.43&nbsp; {}"
3313,Yellow pliable silty clay which turns into mid yellowish grey when wet.  Extent: up to 7m from House 1 wall 1151 northwards Measures between 5 and 25cm thick
3316,"Dark brown, friable clay, loose containing 20% sub angular gravel pebbles of 6mm-6cm and 5% CBM flecks. Clear edge definition"
3316,Fill of post-hole [3325].
3316,Set into clay (1472).
3317,(3317) is the context number given to a dark spread before it was revealed that it was overlain by (3634) and it did not have full extent. It was re-numbered later as (3633) when the deposit's full extent was reveal and it was able to be excavated. For full extent of this deposit see plans for (3633).
3317,Dark spread
3317,"Mid/dark greyish brown, weakly cemented silty clay. Inclusions: 15% with charcoal flecks and CBM flakes Stones: 15-35% (A) (S-A) (2-6mm) (6-20mm) (6-20cm) Depth: c. 10cm"
3318,Dark brown deposit containing 70% sub rounded CBM of 2-6cm. 4cm thick x 80cm x 70cm.
3318,Sits on top of yellow clay (2340) NW of House 1. A single episode of CBM dump.
3318,Very localised CBM spread
3320,Complete pot and contents in pit [3321]
3320,Deliberate pot deposit covered with fill (3308). Silchester Ware vessel. Some bone visible inside the pot as well as in the surrounding fill.
3321,"Cut into the corner of room 5, House 1. Cuts into (1818) yellow clay surface. Slightly elongated in shape with pot sitting in the deepest end towards the corner of the building. Shown on section 307"
3321,"Cut of pit containing (3320) and (3308), room 5, house 1."
3321,Roughly round without corners. 88cm x 62cm x 26cm deep. Fairly steep sides with medium break of slope and circular base.
3322,"Dark greyish brown, friable, clay silt containing 5-15% angular to sub angular flint nodules of 2-6cm. 25cm x 51cm x 40cm Vague edge definition"
3322,Fill of post-hole [3332]
3322,Overlain by shallow spread (3303). identified whilst excavating 3303. Dug in plan not in section. Contained flint nodules which could have been the remains of packing.
3324,"Fill of posthole [3602] above fill (3607). As all flints were found in this context (3324), it is feasible that this deposit represents packing material for the posthole. Plan no: 1.07 Section no: 356"
3324,Possible post-hole
3324,"Yellowish grey, friable clayey silt Clear-vague edge definition Inclusions: Gravel pebbles 15-35% (S-A) (S-R)  (6-20mm) (2-6cm) Width: 68cm   Depth: 45cm"
3325,Circular without corners and measuring 22cm x 33cm deep. Sharp breaks of slope with vertical sides and slightly concave base.
3325,Cut for post-hole containing (3316)
3325,Has only one fill (3316). Cuts into upper clay spread (1472)
3326,"Dark greyish brown, friable clayey silt with pea gravel. Contains 15-35% angular to sub rounded stones. Measurs 5cm thick and visible only within the exploratory trench. Trench measureed 100cm x 65cm."
3326,Thin layer of gravel underlying (2340) and (1165)
3326,Under the wall and discovered when an exploratory trench was put in through wall 1165. Section 309
3327,Brown friable clayey silt. Contains occasional sub rounded gravel pebbles of 2-6mm. Measures 3 cm thick and seen in extent of trench
3327,Observed in exploratory trench through wall 1165
3327,Thin layer of silt underlying (3326)
3328,"Brown, hard poorly sorted gravel. Measures 4cm thick and visible in exploratory trench."
3328,Gravel in trench across wall 1165
3328,Located beneath wall 1165 in exploratory trench. Section 309
3329,Dark silty clay in trench across wall 1165
3329,"Light greyish brown, friable loamy silt. Contains 15% sub angular to sub rounded gravel  of 2mm - 20mm. Measues 100cm x 63cm x 7cm thick Clear edge definition"
3329,Stretches across whole length and width of the slot. Overlain by yellow clay lense (3334)
3330,Dark brown friable silt containing no inclusions. Measures 3cm thick x 45cm x 50cm with clear edge definition
3330,Dark silt in trench across wall 1165
3330,Situated in south east corner of the slot underlying gravel (3329) and overlying gravel (3335). Not planned but shown on sketch plan
3331,Cut of beam slot containing (3305)
3331,Linear feature with rounded corners. Measures 18cm x 100cm x 10cm. Sharp breaks of slope mainly with steep sides mainly and slightly concave base. Good edge definition
3332,Cut for post-hole containing (3322)
3332,"Oval, slightly irregular measuring 51cm x 40cm x 25cm. Sharp breaks of slope with steep almost vertical sides and  slightly concave base. Good edge definition"
3332,Underlying dark spread (3303). North west of Victorian trench and south east of beam slot [3331] to which it might be related.
3334,Light orangy brown friable clay. Has no visible inclusions. measues 25cm x 16cm x 5cm thick. Clear edge definition
3334,"Trench to examine wall 1165. Sits below house clay (3048) in north aisel of House 1. Separeted from (3048) and underlying (3326), (3327) and (3328). Shown on section 309"
3334,Yellow clay lense visible in arbitrary trench
3335,Gravelly deposit
3335,"Mid greyish briwb, friable silty gravel containing 35-70% angular to sub rounded pebbles of 2mm - 6cm. Measues 64cm x 63cm x unknown thickness"
3335,"Visible in south east half of arbitrary trench through wall 1165. represents level to which arbirtrary slot was dug. Continues into the section towards the NE, SE and SW. Towards NW it edges onto dark charcoal rich deposit (3336)"
3336,At the base of the abritrary slot through wall 1165. Situated in the north-west half of the slot edging onto gravel (3335) and continuing onto the section towards the SW and NE. It is possibly a fill of an underlying feature cutting through gravel (3335). Not excavated or investigated as is out of phase and only visible within the slot.
3336,Dark greyish brown friable silty loam. Contains 5-15% sub angular to sub rounded stones of 2mm-20mm. Measures 63cm x 48cm.
3336,"Dark layer, unknown"
3343,Fill of post-hole [3344]
3343,Fill of shallow scoop (3344) situated within NW exterior of House 1.  Cut through the middle by post hole (3325)
3343,"mid greyish brown friable loamy silt measuring 0.10mm thick x 1.05m x 0.75m containing gravel pebbles, cbm flecks and 15-35% sub-angular and sub-rounded stones measuring 6mm-6cm.  Section number 325."
3344,Cut for post-hole containing (3343)
3344,Oval but irregular cut measuring 1.05 x 0.75m x 0.10m thick with shallow irregular sides leading to irregular flattish base.  Section number 325.
3344,"Shallow scoop at the immediate NW exterior of House 1, cutting through dark spread (1277) and yellow clay (2340).  Truncated through the middle by later posthole (3325)."
3345,Possible construction cut containing (3389)
3345,"Rectangular corners 6m x 2m  Depth: c.20cm Breaks of slope, sides and base not fully exposed in 2001 Base has a SW - NE orientation"
3345,Rectangular cut filled by gravel spread (3389) south of Room 7 in House 1. Shallow trench cut into clay (3375) aligning with SE face of wall 1160 and extending up to SW-NE beam slot/drip gully [3348] providing either a limit or more likey a sort of extension to Room 7 towards the SE. To be planned in 2002
3346,"Dark yellow brown, compact, smooth clayey silt containing 1-5% sub angular stones of 2mm - 6cm and also CBM, pot, nails, bone, charcoal and tesserae. 22cm wide x 10cm deep  Extends about 4m along E-W and curves southwards at it's east end Clear edge definition but poor on the west side"
3346,Fill of possible drip gully [3348]
3346,"This feature may constitute a decayed beam or a drip gully silting. It overlies a layer of gravel (3652) which is primary fill. The curve of this feature casts doubt on it being a beam slot.  In the 2002 season, it was confirmed that (3674) is part of (3346) and therefore [3987] is now part of [3348]. Plan no: 12.35, 12.36 Section no: 319"
3347,"Brown, friable silt containing 35-70% sub angular stones of 6mm - 6cm plus CBM, pottery and bone. 10cm thick x 80cm x 70cm. Clear edge definition"
3347,Fill of possible pit / post-hole
3347,South east of House 1 and south of beam slot [3348]. Very shallow so probably not structural.
3348,"Cut for beam slot containing (3346), (3674), (3652), (3675), (3669), (4015)"
3348,"Cut for beam slot or drip gully (although the former is now thought to be more likely since it's complete excavation). Runs parallel with wall 1746 and 1160 and thought to be a southern extent for the 'veranda' of House 1. Also is 5cm south of [3345] veranda cut and thought also to be contemporary with it. In 2002, it was found that [3987] is part of this cut and was re-planned encompassing [3987]. Plan no: 12.38, 12.39 (pre-full excavation). Re-planned and re-digitised in 2002 Plan no: 11.112, 12.84, 12.87, 14.75 Section no: 319"
3348,"Linear in plan running NE-SW in line/parallel with walls 1746 and 1160<BR>0.35m wide and 0.15m deep<BR>Both sides are roughly at 45 degrees <BR>Slightly concave - flat base orientated NE-SW<BR>Contains (3346), (3674), (3652), (3675), (3669), (4015)<BR>Difficult but reasonable edge definition  {}"
3349,Cut for shallow scoop containing (3347)
3349,Originally thought to be a post-hole but the shallowness suggests it is not structural.
3349,Sub circular / oval cut. 80cm x 70cm x 10cm deep Steep sides and more gradual at eastern edge. Very gradual breaks of slope and flat base.
3350,"Dark greyish brown, friable sandy silt containing 35-70% angular to rounded stones of 2mm - 6cm. Measures 5cm thick. Vague edge definition"
3350,Localised gravel spread
3350,"Located south east of Room7, House 1. Overlies mixed clay (3351). Single dump of material or localised levelling deposit."
3351,"Mixed clay deposit with significant amount of gravel and cbm inclusions, sitting on top of yellow clay surface (3375) within room 7, House 1, and also spreading towards SE exterior of the house.  Represents late make up layer or a rough exterior surface once this part of Hse 1goes out of use, as pits [1463] and [1571] have already been cut through."
3351,"Possible late make up layer of Room 7, House 1."
3351,yellowish brown friable clayey silt measuring 0.05m thick x 6m x 2.25m containing gravel and flecks of cbm (20%) and 15-35% sub angular to sub-rounded stones measuring 6mm - 6cm.
